{
  "$schema": "http://json-schema.org/draft-07/schema#",
  "$id": "https://loom.dev/schemas/rule.schema.json",
  "title": "ProjectRule",
  "description": "Project rule catalog entry. Machine-readable. Human-readable derivative optional.",
  "type": "object",
  "required": ["id", "category", "title", "body", "scope", "source", "status", "evidence", "created_at", "updated_at", "version"],
  "properties": {
    "id": { "type": "string", "pattern": "^RULE-[0-9]{4}-[0-9]+-.+$" },
    "category": { "type": "string", "enum": ["naming", "error-handling", "testing", "api-design", "dependencies", "style", "security", "performance", "documentation", "git", "localization", "other"] },
    "title": { "type": "string", "description": "Human-readable title in Russian" },
    "body": { "type": "string", "description": "Full rule text. Machine markers allowed." },
    "scope": { "type": "array", "items": { "type": "string" } },
    "source": {
      "type": "object",
      "required": ["type", "ref"],
      "properties": {
        "type": { "type": "string", "enum": ["operator", "auto-extracted", "agent-decision", "migration"] },
        "ref": { "type": "string" },
        "confidence": { "type": "number", "minimum": 0, "maximum": 1 }
      }
    },
    "status": { "type": "string", "enum": ["proposed", "active", "deprecated", "rejected"] },
    "evidence": { "type": "array", "items": { "type": "string" } },
    "created_at": { "type": "string", "format": "date" },
    "updated_at": { "type": "string", "format": "date" },
    "version": { "type": "integer", "minimum": 1 }
  }
}
